{
  "$schema": "http://localhost:3001/schema/config",
  "group_id": "my-team",
  "owner": "ayansasmal",
  "members": [
    {
      "name": "Ayan",
      "team": "platform",
      "role": "principal_architect",
      "github_username": "ayansasmal",
      "git_email": "ayan@company.com"
    },
    {
      "name": "Alice",
      "team": "security",
      "role": "senior_engineer",
      "github_username": "alice-sec",
      "git_email": "alice@company.com"
    },
    {
      "name": "Bob",
      "team": "platform",
      "role": "engineer",
      "github_username": "bobsmith",
      "git_email": "bob@company.com"
    },
    {
      "name": "Carol",
      "team": "backend",
      "role": "junior",
      "github_username": "carol-dev",
      "git_email": "carol@company.com"
    }
  ],
  "roles": {
    "principal_architect": { "base_confidence": 0.90 },
    "senior_engineer":     { "base_confidence": 0.80 },
    "engineer":            { "base_confidence": 0.70 },
    "junior":              { "base_confidence": 0.60 }
  },
  "domains": {
    "auth": {
      "conflict_threshold": 0.90,
      "required_reviewer_teams": ["security"]
    },
    "infra": {
      "conflict_threshold": 0.88,
      "required_reviewer_teams": ["platform"]
    },
    "payments": {
      "conflict_threshold": 0.92,
      "required_reviewer_teams": ["security", "platform"]
    }
  },
  "thresholds": {
    "conflict_threshold": 0.85,
    "authority_threshold": 0.20
  }
}
